Domain Modat Petit Modat'mour Blanc Organic 2019,https://www.lcbo.com/webapp/wcs/stores/servlet/en/lcbo/white-wine-14002/domain-modat-petit-modatmour-blanc-organic-2019-931716,$31.50,/content/dam/lcbo/products/931716.jpg/jcr:content/renditions/cq5dam.web.319.319.jpeg,"Domaine Modat is located in Roussillon (Agly valley). Certified organic with biodynamic practices, the wines are a sincere reflection of the land where they are produced. Le petit modat'mour blanc is a blend of Muscat, Roussane and white Grenache. Full of flavour with notes of tropical fruits and white spices. This wine pairs well with a creamy cheese or a ceviche.",750 mL bottle,12.5%,France,F De F Selection,,,,White Blend,,,
Le Vieux Pin-Petit Blanc 2019,https://www.lcbo.com/webapp/wcs/stores/servlet/en/lcbo/white-wine-14002/le-vieux-pin-petit-blanc-2019-966886,$28.75,/content/dam/lcbo/products/966886.jpg/jcr:content/renditions/cq5dam.web.319.319.jpeg,"A unique blend of Sauvignon Blanc, Muscat and Pinot Gris, Marsanne and Roussanne. Green citrus fruit, gooseberries, currants and touch of tropical fruits greet you on the nose. While orchard fruits are tasted on the mid palate, the finish and core of this wine is dominated by citrus and gooseberry.",750 mL bottle,12.2%,"British Columbia, Canada",Enotecca Winery & Resorts Inc.,,,,Sauvignon Blanc Blend,,,
Domaine Fournier Terres Blanches 2016,https://www.lcbo.com/webapp/wcs/stores/servlet/en/lcbo/white-wine-14002/domaine-fournier-terres-blanches-2016-923838,$53.90,/content/dam/lcbo/products/923838.jpg/jcr:content/renditions/cq5dam.web.319.319.jpeg,"Tense, mineral precise, our Terres Blanches is a treat for all Sauvignon Blanc lovers! The nose reveals persistent boxwood and blackcurrant bud aromas. The palate is a masterpiece of concentration and length. Pair with more complex dishes such as creamed poultry and grilled prawns. Awards: 91 Points Decanter",750 mL bottle,12.5%,France,Domaine Fournier,,,,Sauvignon Blanc,,,
Château Moncontour Demi-Sec Vouvray 2019,https://www.lcbo.com/webapp/wcs/stores/servlet/en/lcbo/white-wine-14002/ch%C3%A2teau-moncontour-demi-sec-vouvray-2019-16709,$20.95,/content/dam/lcbo/products/016709.jpg/jcr:content/renditions/cq5dam.web.319.319.jpeg,"In this wine the balance between lemon fruits and light sweetness is impeccable. Fruity with baked apple flavors, it's lightly textured, perfumed and worth aging. Drink from 2021. Editors' Choice.  Score - 90. (Roger Voss, Wine Enthusiast, July 1, 2020)",750 mL bottle,11.5%,"Loire, France",Chateau Moncontour,20 g/L,M - Medium,Off-dry & Fruity,Chenin Blanc,"May 1, 2021",,
Domaine Germain Beaune 1er cru Blanc 2018,https://www.lcbo.com/webapp/wcs/stores/servlet/en/lcbo/white-wine-14002/domaine-germain-beaune-1er-cru-blanc-2018-935428,$55.75,/content/dam/lcbo/products/935428.jpg/jcr:content/renditions/cq5dam.web.319.319.jpeg,"Great value 1er cru from Côte de Beaune! Gold colour with hints of green. Complex with notes of apple, peach, vanilla and pepper, the nose is intense and fruity. In the mouth, it's a powerful white wine. Delicate notes of honey and fresh, great pairing with veal in a mushroom sauce, lobster or asparagus.",750 mL bottle,13.5%,"Burgundy, France",Sarl Isabelle Et Philippe Germ,,,,Chardonnay,,,
Domaine Germain Auxey-Duresses Blanc 2018,https://www.lcbo.com/webapp/wcs/stores/servlet/en/lcbo/white-wine-14002/domaine-germain-auxey-duresses-blanc-2018-935410,$53.40,/content/dam/lcbo/products/935410.jpg/jcr:content/renditions/cq5dam.web.319.319.jpeg,"Manually harvested. Aged in oak barrels for 10 months (10% new barrels) A neighbour of Meursault, we find in this white wine the weight and generosity of the Côte de Beaune great white wines. Delicate and floral bouquet, subtlety in the mouth, balance, integrated wood and beautiful acidity.",750 mL bottle,13%,"Burgundy, France",Sarl Isabelle Et Philippe Germ,,,,Chardonnay,,,
Smallfry Isolar 2020,https://www.lcbo.com/webapp/wcs/stores/servlet/en/lcbo/white-wine-14002/smallfry-isolar-2020-929348,$54.65,/content/dam/lcbo/products/929348.jpg/jcr:content/renditions/cq5dam.web.319.319.jpeg,"Whole bunch basket pressed and straight to barrel for fermentation and maturation on gross lees. Picked later for riper spectrum flavours it is the Roussane that gives the freshness and acidity while the Riesling plays a juicier, fruitier role. Yellow/gold colour, unfined or filtered. Honeysuckle, tropical fruit, grapefruit pith, medicinal eucalypt lollies, lots going on. Fresh and juicy up front leading to quite a broad midpalate with the furniture showing up on the back to add length.",750 mL bottle,12%,"South Australia, Australia",W.G Ahrens + S.L Hilder Trading As,,,,Riesling Blend,,,
Casot d'en Gora Organic 2017,https://www.lcbo.com/webapp/wcs/stores/servlet/en/lcbo/white-wine-14002/casot-den-gora-organic-2017-942408,$35.60,/content/dam/lcbo/products/942408.jpg/jcr:content/renditions/cq5dam.web.319.319.jpeg,"A complex, rich and well-structured blend of organically grown Grenache Blanc, Grenache Gris and Macabeu from the dry, warm, wind-swept vineyards of Roussillon. Fermented and aged in large, Austrian barrels, to shows aromas ranging from zesty citrus and tree fruit to ripe melon and pineapple. The palate is full and flavourful adding a smokey, savoury minerality and a hint of vanilla.",750 mL bottle,13.5%,"Roussillon, France",Domaine Des Schistes,,,,Grenache Blanc Blend,,,
Entre Colinas White 2019,https://www.lcbo.com/webapp/wcs/stores/servlet/en/lcbo/white-wine-14002/entre-colinas-white-2019-930692,$13.50,/content/dam/lcbo/products/930692.jpg/jcr:content/renditions/cq5dam.web.319.319.jpeg,"It is the result of the selection of a batch of grapes that produce this harmonious, light, fresh, aromatic and mineral wine, balanced green fruit. It was pressed with whole grapes and the must fermented at 14º C.",750 mL bottle,13.5%,"Dão, Portugal","Empresa Vinicola Vilanovense, Lda",,,,White Blend,,,
Domain CLO Saumur Blanc,https://www.lcbo.com/webapp/wcs/stores/servlet/en/lcbo/white-wine-14002/domain-clo-saumur-blanc-980945,$30.50,/content/dam/lcbo/products/980945.jpg/jcr:content/renditions/cq5dam.web.319.319.jpeg,"Located in the Loire valley (north of Puy-Notre-Dame), Domaine CLO is organic certified. Cyril Leau took over his father's vineyard in 2015 to make wines with character. This 100% Chenin blanc has a bright yellow color. Expressive nose with notes of citrus (lime, grapefruit) and white fruits (pear, peach). Subtle mouth, fresh and balance with notes of apple and a very nice length. Elegant wine to be paired with fish or fruit salad.",750 mL bottle,13.5%,"Loire, France",F De F Selection,,,,Chenin Blanc,,,
Domaine Germain Monthélie Blanc 2019,https://www.lcbo.com/webapp/wcs/stores/servlet/en/lcbo/white-wine-14002/domaine-germain-month%C3%A9lie-blanc-2019-984327,$50.90,/content/dam/lcbo/products/984327.jpg/jcr:content/renditions/cq5dam.web.319.319.jpeg,"Manually harvested. Aged in oak barrels for 10 months (10% new barrels) with a batonnage every 15 days until fermented. Fine and fruity with aromas of dried fruits (apricot, peach). Enjoy with shellfish or fish. 3 - 5 years aging.",750 mL bottle,13.5%,"Burgundy, France",Sarl Isabelle Et Philippe Germ,,,,Chardonnay,,,
Michael David Chardonnay 2019,https://www.lcbo.com/webapp/wcs/stores/servlet/en/lcbo/white-wine-14002/michael-david-chardonnay-2019-396283,$26.95,/content/dam/lcbo/products/396283.jpg/jcr:content/renditions/cq5dam.web.319.319.jpeg,"The grapes for this wine are hand-picked and used to make three Chardonnays, which are then blended together to create the final wine. The portions fermented and aged in stainless steel bring lift, freshness and crisp fruit, while those elements fermented and aged in French oak and on the lees impart complexity, depth and a round, soft texture. Pair with grilled chicken or pork chops.",750 mL bottle,14.5%,"California, USA",Michael David Vineyards,5 g/L,XD - Extra Dry,Full-bodied & Rich,Chardonnay,"May 1, 2021",,
Grand'Arte Chardonnay 2018,https://www.lcbo.com/webapp/wcs/stores/servlet/en/lcbo/white-wine-14002/grandarte-chardonnay-2018-929504,$20.10,/content/dam/lcbo/products/929504.jpg/jcr:content/renditions/cq5dam.web.319.319.jpeg,"Aromatic, fruity, rich, round, with a soft acidity which gives an excellent tasty, fresh wine. Very pleasant with a long elegant and persistent end.",750 mL bottle,12.5%,Portugal,Dfj Vinhos Lda.,,,,Chardonnay,,,
Grand'Arte Alvarinho 2019,https://www.lcbo.com/webapp/wcs/stores/servlet/en/lcbo/white-wine-14002/grandarte-alvarinho-2019-929546,$20.10,/content/dam/lcbo/products/929546.jpg/jcr:content/renditions/cq5dam.web.319.319.jpeg,"A fruited wine of real finesse with an intense aroma of ripe orchard fruits. The body is full with a delicious, creamy character and this is countered by a fresh, citrus quality on a long finish.",750 mL bottle,13%,Portugal,Dfj Vinhos Lda.,,,,Alvarinho,,,
Alfaciafacinha White IGP LX 2019,https://www.lcbo.com/webapp/wcs/stores/servlet/en/lcbo/white-wine-14002/alfaciafacinha-white-igp-lx-2019-922020,$10.20,/content/dam/lcbo/products/922020.jpg/jcr:content/renditions/cq5dam.web.319.319.jpeg,"Citrus coloured wine, with fruity and fresh aromas. Good acidity and well-balanced in the mouth, with a very pleasant aftertaste.",750 mL bottle,12.5%,Portugal,"Parras Wines, Unipessoal Lda",,,,Arinto Blend,,,
Recaredo Miranius 2018,https://www.lcbo.com/webapp/wcs/stores/servlet/en/lcbo/white-wine-14002/recaredo-miranius-2018-598473,$23.80,/content/dam/lcbo/products/598473.jpg/jcr:content/renditions/cq5dam.web.319.319.jpeg,"Miranius' is named after a local fox that invades the vineyards to gorge on the grapes. The grapes come from very low yielding vines and is unoaked. Lively and refreshing, its naturally vibrant acidity makes this a great food wine. A clear pale gold in the glass. Complex scents of lime, pear and orange flower. On the palate, bright and refreshing with a vibrant acidity leading to a lengthy finish. 91P Robert Parker, 90P Penin",750 mL bottle,11%,"Penedès, Spain",Recaredo Mata Casanovas S.A.,,,,Xarel-lo,,,
Lykos Malagousia PGI Evia 2019,https://www.lcbo.com/webapp/wcs/stores/servlet/en/lcbo/white-wine-14002/-lykos-malagousia-pgi-evia-2019-913813,$27.40,/content/dam/lcbo/products/913813.jpg/jcr:content/renditions/cq5dam.web.319.319.jpeg,"Bright golden-green colour with intensely complex aromas of citrus, pineapple, apricot and peach. Cool with pleasant acidity, exceptionally balanced palate and long aftertaste.",750 mL bottle,12.5%,Greece,Lykos Winery,,,,Malagousia,,,
Cascina Castlet ATAJ Chardonnay 2019,https://www.lcbo.com/webapp/wcs/stores/servlet/en/lcbo/white-wine-14002/cascina-castlet-ataj-chardonnay-2019-938208,$17.90,/content/dam/lcbo/products/938208.jpg/jcr:content/renditions/cq5dam.web.319.319.jpeg,"Beautiful straw-yellow colour with slight, greenish reflections. A wide-ranging, intense, fruity and flowery bouquet, highly pleasing and very long-lasting. A dry taste, well structured and pleasantly acidulous; delicate and elegant, it is enhanced by a long aromatic persistence. Excellent as an aperitif, ideal with hors d'oeuvres and it goes nicely with first courses containing light sauces and with second courses of fish and shellfish. Best served at a temperature of 10-12°C in a long-stemmed, tulip-shaped, flared-rim glass.",750 mL bottle,13.5%,"Piedmont, Italy",Cascina Castelet,,,,Chardonnay,,,
Pop Art White PGI Evia 2019,https://www.lcbo.com/webapp/wcs/stores/servlet/en/lcbo/white-wine-14002/pop-art-white-pgi-evia-2019-913789,$16.25,/content/dam/lcbo/products/913789.jpg/jcr:content/renditions/cq5dam.web.319.319.jpeg,"Lykos Pop Art White is a beautiful white wine gem from vineyards in northern and southern Evia. Lemon green in colour with a bouquet of flowers and citrus fruits, and a cool, palate-pleasing acidity. Well balanced in fruit and acidity to enjoy over the next 4-5 years, the wine is long and pleasing on the finish.",750 mL bottle,12%,Greece,Lykos Winery,,,,White Blend,,,
Pères de Eglise Calice de St. Pierre Châteauneuf Blanc 2019,https://www.lcbo.com/webapp/wcs/stores/servlet/en/lcbo/white-wine-14002/p%C3%A8res-de-eglise-calice-de-st-pierre-ch%C3%A2teauneuf-blanc-2019-832667,$61.60,/content/dam/lcbo/products/832667.jpg/jcr:content/renditions/cq5dam.web.319.319.jpeg,"Jeb Dunnuck 90 'The 2019 Châteauneuf Du Pape Le Calice De Saint Pierre Blanc offers lots of honeyed citrus, crushed stone, a touch of celery seed, and white flower-like aromas and flavors. These all carry to a medium to full-bodied, fresh, lively white with a solid spine of acidity, terrific focus on the palate, and a crisp, clean finish. It's going to drink nicely for 7-8 years.'",750 mL bottle,13.5%,France,Scea Paulette Gradassi + Fils,,,,Marsanne/Roussane,,,
Giannikos Windmill Malagouzia PGI 2019,https://www.lcbo.com/webapp/wcs/stores/servlet/en/lcbo/white-wine-14002/giannikos-windmill-malagouzia-pgi-2019-912351,$22.25,/content/dam/lcbo/products/912351.jpg/jcr:content/renditions/cq5dam.web.319.319.jpeg,"Light green-yellow colour, intensively aromatic with clear scents of apricot, peach, pear and a natural hint of lemon peel. Well balanced with a fresh acidity.",750 mL bottle,13%,"Peloponnese, Greece",Giannikos Winery,,,,Malagousia,,,
Giannikos At Sea Roditis PGI P2019,https://www.lcbo.com/webapp/wcs/stores/servlet/en/lcbo/white-wine-14002/giannikos-at-sea-roditis-pgi-p2019-912419,$20.25,/content/dam/lcbo/products/912419.jpg/jcr:content/renditions/cq5dam.web.319.319.jpeg,"Pale lemon tint, intensely aromatic with fresh hints of grapefruit and melon, combined with a crisp acidity.",750 mL bottle,12.5%,"Peloponnese, Greece",Giannikos Winery,,,,Roditis,,,
Alta Alella Tallarol 2019,https://www.lcbo.com/webapp/wcs/stores/servlet/en/lcbo/white-wine-14002/alta-alella-tallarol-2019-920537,$31.55,/content/dam/lcbo/products/920537.jpg/jcr:content/renditions/cq5dam.web.319.319.jpeg,"A juicy, aromatic and fresh white wine. Aromas of white fruit, citrus and notes of fennel on the nose. In the mouth, it is unctuous, balanced and long.",750 mL bottle,12%,Spain,Alta Alella S.L.,,,,Xarel-lo,,,
Millton Crazy by Nature Sirius White,https://www.lcbo.com/webapp/wcs/stores/servlet/en/lcbo/white-wine-14002/millton-crazy-by-nature%C2%A0sirius%C2%A0white-922780,$26.50,/content/dam/lcbo/products/922780.jpg/jcr:content/renditions/cq5dam.web.319.319.jpeg,"Sirius White is a blend of Chardonnay, Viognier, Marsanne and Vermentino. This wine has a warm ripe apricot character with lifted acidity, scented white peach and honeysuckle and finishing with a soft, fat warm mouth-filling character of immediate appeal. A fruit forward expressive un-oaked style.",750 mL bottle,13%,New Zealand,The Millton Vineyard Limited,,,,Chardonnay Blend,,,
Drius Pinot Bianco Isonzo del Friuli 2018,https://www.lcbo.com/webapp/wcs/stores/servlet/en/lcbo/white-wine-14002/drius-pinot-bianco-isonzo-del-friuli-2018-923002,$30.00,/content/dam/lcbo/products/923002.jpg/jcr:content/renditions/cq5dam.web.319.319.jpeg,"Fascinating greenish yellow, crystalline and consistent. The first nose, stony and oxidized notes, the minerality and the wood mark the step with their presence. Elder flowers, pineapple, lime, white grapefruit, then the wine has a phase stall, a stand-by of the aromas, and reopens with gravely notes, walnut husk. An interesting wine showing softness and flavour on the palate with a final note of white licorice.",750 mL bottle,13%,"Friuli, Italy",Az. Ag. Drius Mauro,,,,Pinot Bianco,,,
Weingut Weinrieder Ried Bockgarten Riesling 2018,https://www.lcbo.com/webapp/wcs/stores/servlet/en/lcbo/white-wine-14002/weingut-weinrieder-ried-bockgarten-riesling-2018-932193,$27.85,/content/dam/lcbo/products/932193.jpg/jcr:content/renditions/cq5dam.web.319.319.jpeg,"Concentrated on the nose and on the palate, beautiful sweetness blended with a fresh acidity - a great Riesling. Displays stone fruit, delicate lime, and hints of ripe pear. On the palate there are flavours of juicy white peach and subtle hints of apricot. This wine is well balanced by a refined structure, very fresh, crisp and plush acidity.",750 mL bottle,13%,Austria,Weinrieder,,,,Riesling,,,
Weingut Weinrieder Riesling Reserve 2017,https://www.lcbo.com/webapp/wcs/stores/servlet/en/lcbo/white-wine-14002/weingut-weinrieder-riesling-reserve-2017-932227,$60.85,/content/dam/lcbo/products/932227.jpg/jcr:content/renditions/cq5dam.web.319.319.jpeg,"Riesling pure! The Reserve is a selection of top Riesling Grapes. Classy, elegant wine with high potential. Elegant, dense, brilliant structure, wonderful. Perfect with exotic and Asian cuisine.",750 mL bottle,13.5%,Austria,Weinrieder,,,,Riesling,,,
Weingut Weinrieder Gruner Veltliner Old Vines,https://www.lcbo.com/webapp/wcs/stores/servlet/en/lcbo/white-wine-14002/weingut-weinrieder-gruner-veltliner-old-vines-932235,$37.85,/content/dam/lcbo/products/932235.jpg/jcr:content/renditions/cq5dam.web.319.319.jpeg,"Vegetal and a trace of nutty aromas of ripe yellow fruits with delicate oily notes, some minerality, rhubarb and a hint of bright tobacco. Sweet and creamy, very ripe fruit on the palate, delicate vegetal and nutty spiciness, very fine acidity, persistent, has full-bodied and polished, crumbly tannin, candied nutty traces, a little warm finish with light sweetness and spice.",750 mL bottle,13.5%,Austria,Weinrieder,,,,Grüner Veltliner,,,
Weingut Weinrieder Birthal Weissburgunder 2017,https://www.lcbo.com/webapp/wcs/stores/servlet/en/lcbo/white-wine-14002/weingut-weinrieder-birthal-weissburgunder-2017-932250,$25.85,/content/dam/lcbo/products/932250.jpg/jcr:content/renditions/cq5dam.web.319.319.jpeg,"Elegant wine with power and harmony notes of yellow fruits, light pineapple and hint of lemon. Very powerful yet supple, with a very full fruit sweetness. It is dominated by peach and apricot notes with mild hints of pineapple. Long finish, absolutely full-bodied.",750 mL bottle,13%,Austria,Weinrieder,,,,White - Fruity,,,
Weingut Weinrieder Gruner Veltliner Reserve Old Vines 2016,https://www.lcbo.com/webapp/wcs/stores/servlet/en/lcbo/white-wine-14002/weingut-weinrieder-gruner-veltliner-reserve-old-vines-2016-932268,$54.85,/content/dam/lcbo/products/932268.jpg/jcr:content/renditions/cq5dam.web.319.319.jpeg,"Complex nose with vegetal and slightly earthy aromas, pome fruit, a hint of citrus and a little pepper. Mature, quiet, creamy fruit on the palate, much vegetal and earthy notes again, moderate acidity, good persistence, nutty, mineral and delicate peppery tones, solid construction, a hint of caramel and tobacco.",750 mL bottle,13%,Austria,Weinrieder,,,,Grüner Veltliner,,,
Richter Riesling Classic 2019,https://www.lcbo.com/webapp/wcs/stores/servlet/en/lcbo/white-wine-14002/richter-riesling-classic-2019-952951,$19.95,/content/dam/lcbo/products/952951.jpg/jcr:content/renditions/cq5dam.web.319.319.jpeg,"'The 2019 Riesling Classic comes from 40 - 50-year-old vines in the villages of Veldenz and Burgen (Middle Mosel9, and was fermented down to almost dry levels of residual sugar (10 g/l). It offers a tantalizing nose made of floral elements, white peach, freshly cut apple, pear and smoke. The wine is playful and delightful driven by fruits and minerals on the palate and leaves a gorgeous sense of fresh herbs in the long and refined finish. This dry tasting wine offers textbook Mosel pleasure. (Now - 2027)' (MFW, June 2020) '",750 mL bottle,11.5%,"Mosel, Germany","Richter, Dr. Dirk M.",,,,Riesling,,,
Siegrist Pinot Blanc VDP Gutswein 2019,https://www.lcbo.com/webapp/wcs/stores/servlet/en/lcbo/white-wine-14002/siegrist-pinot-blanc-vdp-gutswein-2019-957877,$25.15,/content/dam/lcbo/products/957877.jpg/jcr:content/renditions/cq5dam.web.319.319.jpeg,"First a decent gentle perfume then a surprising opening in mouth with green apple, pear and honey melon, juicy and powerful, lively and complex with a refreshing acidity and lightly mineral finish. Food recommendation fish, seafood, white meat, for e.g. Blanquette de veaux (veal ragout) , lotte de mer (monkfish) in lemon sauce or rabbit in a Riesling cream.",750 mL bottle,12.5%,"Pfalz, Germany","Funf Winzer, Funf Freunde",,,,Pinot Blanc,,,
Siegrist Leinsweiler Riesling Eigensinn VDP Ortswein 2019,https://www.lcbo.com/webapp/wcs/stores/servlet/en/lcbo/white-wine-14002/siegrist-leinsweiler-riesling-eigensinn-vdp-ortswein-2019-957901,$34.25,/content/dam/lcbo/products/957901.jpg/jcr:content/renditions/cq5dam.web.319.319.jpeg,"A masterpiece of Riesling which demonstrates perfectly the precious mussle limestone terroir. A bouquet of herbs and yellow stone fruit combined with a straight forward minerality. Very complex and elegant. The expressive minerality of the terroir completes this Riesling giving an incredible deepness and finesse. Pair with dishes of fish and white meat, for e.g. Blanquette de veaux (veal ragout) , lotte de mer (monkfish) in lemon sauce or rabbit in a Riesling cream.",750 mL bottle,12.5%,"Pfalz, Germany","Funf Winzer, Funf Freunde",,,,Riesling,,,
Zulal Voskehat 2019,https://www.lcbo.com/webapp/wcs/stores/servlet/en/lcbo/white-wine-14002/zulal-voskehat-2019-932557,$19.50,/content/dam/lcbo/products/932557.jpg/jcr:content/renditions/cq5dam.web.319.319.jpeg,"Translating as 'golden berry' Voskehat is a late-ripening thick-skinned ancient grape variety. It is widespread in Aragatsotn, Armavir and Vayots Dzor. This wine has a vibrant light gold colour and rich floral aromas with notes of tropical and stone fruit on the palate. Finish is crisp and elegant.",750 mL bottle,13.5%,Armenia,Zulal Wines Llc,,,,White - Light Dry,,,
Quinta dos Mattos Reserva 2019,https://www.lcbo.com/webapp/wcs/stores/servlet/en/lcbo/white-wine-14002/quinta-dos-mattos-reserva-2019-933480,$21.60,/content/dam/lcbo/products/933480.jpg/jcr:content/renditions/cq5dam.web.319.319.jpeg,"Intense with notes of white fruits, new wood and vanilla. Concentrated in the mouth, fresh and fruity; balanced and a long finish.",750 mL bottle,13%,"Douro, Portugal","Coimbra De Mattos, Lda",,,,White Blend,,,
Oshin White 2017,https://www.lcbo.com/webapp/wcs/stores/servlet/en/lcbo/white-wine-14002/oshin-white-2017-932532,$39.60,/content/dam/lcbo/products/932532.jpg/jcr:content/renditions/cq5dam.web.319.319.jpeg,"Gold in the glass, this barrel-fermented Voskehat has prominent aromas of ripe stone fruits, summer blossom and hints of grapefruit complemented by sweet toast. The palate is creamy balancing the notes of lemon, peach, melon and roasted almonds lingering on the tongue for a while after the sip.",750 mL bottle,13%,Armenia,Oshin Cellars Llc,,,,White - Light Dry,,,
Domaine Jacques Prieur Meursault Clos de Mazeray Monopole 2017,https://www.lcbo.com/webapp/wcs/stores/servlet/en/lcbo/white-wine-14002/domaine%C2%A0jacques-prieur-meursault-clos%C2%A0de%C2%A0mazeray-monopole-2017-960608,$127.65,/content/dam/lcbo/products/960608.jpg/jcr:content/renditions/cq5dam.web.319.319.jpeg,"THE FINE WINE REVIEW 90-92: ~33%% vinified and aged in foudre. Butter and mineral nose. Good layering in mouth, good acidity and crispness. Length is here. Lime and grapefruit. Still rather tight. Excellent focus and purity, plus a touch of rusticity that is typical of Clos de Mazeray.",750 mL bottle,13.5%,France,Sas Labruyere Prieur Selection,,,,Chardonnay,,,
Smallfry BV Riesling 2018,https://www.lcbo.com/webapp/wcs/stores/servlet/en/lcbo/white-wine-14002/smallfry-bv-riesling-2018-929389,$29.25,/content/dam/lcbo/products/929389.jpg/jcr:content/renditions/cq5dam.web.319.319.jpeg,"Medium bodied white wine. Bright with pale yellow tints in colour, on the nose, aromas of lime and honey with notes of mineral. Light tannins. High acidity. Green and flinty white wine in style. On the palate, fresh, youthful, juicy, cool, approachable, crisp and dry with hint of citrus and lemon sherbet. It has a lingering finish.",750 mL bottle,10%,"South Australia, Australia",W.G Ahrens + S.L Hilder Trading As,,,,Riesling,,,
Domaine Jacques Prieur Beaune 1er Champs-Pimont Blanc 2017,https://www.lcbo.com/webapp/wcs/stores/servlet/en/lcbo/white-wine-14002/domaine-jacques-prieur-beaune-1er-champs-pimont-blanc-2017-960590,$96.90,/content/dam/lcbo/products/960590.jpg/jcr:content/renditions/cq5dam.web.319.319.jpeg,"THE FINE WINE REVIEW 91-94: 50% vinified and aged in large foudres. Apple-calvados nose - very attractive. Gentler on the palate with not such an imposing structure;medium-light on the tongue, but good structure here. Another style of Beaune, one with more finesse than the Grèves, but still with minerality and structure. Sensuality on the palate.",750 mL bottle,13%,France,Sas Labruyere Prieur Selection,,,,Chardonnay,,,
Vivi Vermentino Toscana IGT 2019,https://www.lcbo.com/webapp/wcs/stores/servlet/en/lcbo/white-wine-14002/vivi-vermentino-toscana-igt-2019-922426,$20.80,/content/dam/lcbo/products/922426.jpg/jcr:content/renditions/cq5dam.web.319.319.jpeg,"James Suckling: 91 points 2018 'This wine has a very intense scent of fresh floral notes with a little mineral hint. The taste is fresh, full, and pleasant. The balanced acidity gives freshness with persistence flavours and makes it a perfect aperitif on a summer evening. Ideal service temperature is 8 - 10 °C. Ideal to drink by itself, or paired with vegetables, seafood, salads and soft cheeses.'",750 mL bottle,12.5%,Italy,Tenuta Del Buonamico Societa A,,,,White Blend,,,
