Kellerei Bozen Bolzano Chardonnay 2019,https://www.lcbo.com/webapp/wcs/stores/servlet/en/lcbo/wine-14/white-wine-14002/kellerei-bozen-bolzano-chardonnay-2019-570457,$19.00,/content/dam/lcbo/products/570457.jpg/jcr:content/renditions/cq5dam.web.319.319.jpeg,"This wine is fermented and aged in stainless steel to preserve the purity of the most delicate floral and fruit tones. The result is a fresh, vibrant, tropical Chardonnay with a driving acidity and a bright, crisp character.",750 mL bottle,13.5%,"Alto Adige-Trentino, Italy",Cantina Bolzano,5 g/L,XD - Extra Dry,Light & Crisp,Chardonnay,"June 14, 2020",,
Las Mulas Chardonnay Reserva Organic,https://www.lcbo.com/webapp/wcs/stores/servlet/en/lcbo/white-wine-14002/las-mulas-chardonnay-reserva-organic-572362,$13.95,/content/dam/lcbo/products/572362.jpg/jcr:content/renditions/cq5dam.web.319.319.jpeg,"The Miguel Torres family has been dedicated to making quality wines for decades. This certified organic chardonnay pours pale lemon and has aromas of yellow pear, melon, honey and a hint of nutty oak. Flavours of pear and white melon lead to a medium-bodied and fruity palate with a refreshingly bright and balanced finish.",750 mL bottle,13%,Chile,Soc. Vinicola Miguel Torres Ltda.,4 g/L,XD - Extra Dry,Full-bodied & Rich,Chardonnay,,,
Adesso ChardonnayD'Italia,https://www.lcbo.com/webapp/wcs/stores/servlet/en/lcbo/white-wine-14002/adesso-chardonnayditalia-572461,$8.30,/content/dam/lcbo/products/572461.jpg/jcr:content/renditions/cq5dam.web.319.319.jpeg,"This lovely chardonnay from Italy delivers on flavour. Pale yellow colour followed by aromas of fresh bread, coffee, earth, smoke and spice. The palate is light to medium bodied and filled with rich fruit flavours, hints of smoky oak and spice. The finish is warming and harmonious.",750 mL bottle,12%,"Veneto, Italy",Caviro Soc. Coop.,9 g/L,D - Dry,Light & Crisp,Chardonnay,,,
Sola Nero White,https://www.lcbo.com/webapp/wcs/stores/servlet/en/lcbo/white-wine-14002/sola-nero-white-572891,$15.10,/content/dam/lcbo/products/572891.jpg/jcr:content/renditions/cq5dam.web.319.319.jpeg,"Pale straw colour; pleasant pear and nutty aromas with hints of herbs; soft, fruity and clean flavour with good balance on the pleasant finish.",1500 mL bottle,12%,Canada,"Arterra Wines Canada, Inc.",16 g/L,D - Dry,Light & Crisp,Blend,,,
Malivoire Estate Grown Chardonnay,https://www.lcbo.com/webapp/wcs/stores/servlet/en/lcbo/white-wine-14002/malivoire-estate-grown-chardonnay-573147,$19.95,/content/dam/lcbo/products/573147.jpg/jcr:content/renditions/cq5dam.web.319.319.jpeg,"Chardonnay is this sustainable winery's specialty, and this one is superb. It sports complex baked apple, caramel and toasty oak flavours with a mineral-laced finish. Pair with fish and chips, pasta primavera or roast turkey with all the trimmings.",750 mL bottle,13.2%,"Ontario, Canada",Malivoire Wine Co.,2 g/L,XD - Extra Dry,Full-bodied & Rich,Chardonnay,"April 1, 2021",,
Magnotta Pinot Grigio Venture Series VQA,https://www.lcbo.com/webapp/wcs/stores/servlet/en/lcbo/white-wine-14002/magnotta-pinot-grigio-venture-series-vqa-574533,$13.45$14.95Save $1.50,/content/dam/lcbo/products/574533.jpg/jcr:content/renditions/cq5dam.web.319.319.jpeg,"Magnotta is a family-owned winery and one of the largest in Ontario. This pinot grigio is pale straw in colour and exhibits aromas of nuts, citrus, smoke, fig and melon. Medium-bodied this is a vibrant wine with a refreshingly clean finish.",750 mL bottle,12.5%,"Ontario, Canada",Magnotta Winery,7 g/L,XD - Extra Dry,Light & Crisp,Pinot Grigio,,,
Fern Walk Sauvignon Blanc VQA,https://www.lcbo.com/webapp/wcs/stores/servlet/en/lcbo/white-wine-14002/fern-walk-sauvignon-blanc-vqa-575639,$16.95,/content/dam/lcbo/products/575639.jpg/jcr:content/renditions/cq5dam.web.319.319.jpeg,"Fern Walk's success began in BC, quickly developing a following for making flavourful, quality wines. Niagara grown and crafted, this wine captures vibrant citrus, nutty, green berry, smoky and herbal aromas and flavours; medium-plus body yet refreshing, it finishes with snappy acidity and replays of citrus and asparagus.",750 mL bottle,12.5%,"Ontario, Canada",Artisan Wine Co.,5 g/L,XD - Extra Dry,Aromatic & Flavourful,Sauvignon Blanc,,,
Diabolica White VQA,https://www.lcbo.com/webapp/wcs/stores/servlet/en/lcbo/white-wine-14002/diabolica-white-vqa-576942,$13.95,/content/dam/lcbo/products/576942.jpg/jcr:content/renditions/cq5dam.web.319.319.jpeg,"An imaginative blend of aromatic varieties; delicious on its own and quite versatile with food. Clear medium lemon-yellow in colour; quite forward, with aromas of lemon, fresh fig, smoke and pine nuts; extra dry, with medium body and moderate balanced acidity; flavours of lemon, fig and nuts.",750 mL bottle,12.5%,"Ontario, Canada",Artisan Wine Co.,14 g/L,D - Dry,Aromatic & Flavourful,White Blend,,,
Ruffino Il Ducale Pinot Grigio 2018,https://www.lcbo.com/webapp/wcs/stores/servlet/en/lcbo/wine-14/white-wine-14002/ruffino-il-ducale-pinot-grigio-2018-577999,$18.95,/content/dam/lcbo/products/577999.jpg/jcr:content/renditions/cq5dam.web.319.319.jpeg,"Ruffino has been making wines since 1877, but this bright, airy Pinot Grigio is a newcomer to the portfolio and was first produced in 2016. It's crafted in an easy-to-like, drinkable style that delivers excellent refreshment and lift, with a touch of exotic, tropical melon. The producer suggests pairing this floral, fruity wine with spinach gnocchi or Parmigiano Reggiano.",750 mL bottle,12.5%,"Friuli, Italy",Ruffino S.R.L.,3 g/L,XD - Extra Dry,Light & Crisp,Pinot Grigio,"March 20, 2021",,
Casillero del Diablo Reserva Sauvignon Blanc,https://www.lcbo.com/webapp/wcs/stores/servlet/en/lcbo/white-wine-14002/casillero-del-diablo-reserva-sauvignon-blanc-578641,$12.95,/content/dam/lcbo/products/578641.jpg/jcr:content/renditions/cq5dam.web.319.319.jpeg,"Pale straw colour; pronounced aromas and flavours of grapefruit and spice with minerally and herbal notes; medium body, medium acidity, fresh and juicy.",750 mL bottle,13%,Chile,Concha Toro S.A.,3 g/L,XD - Extra Dry,Light & Crisp,Sauvignon Blanc,,,
Blu Giovello Pinot Grigio,https://www.lcbo.com/webapp/wcs/stores/servlet/en/lcbo/white-wine-14002/blu-giovello-pinot-grigio-580183,$12.80,/content/dam/lcbo/products/580183.jpg/jcr:content/renditions/cq5dam.web.319.319.jpeg,"Produced in north-eastern Italy in the region of Friuli, it's a pale-coloured, clean and refreshing wine. The bouquet opens with distinct notes of quince, fruit blossom, nuts, spice and candy. Medium-minus body and fresh on the palate with more tree fruit flavours and hints of spice that add balance to a clean finish.",750 mL bottle,12%,"Friuli, Italy",Martellozzo S.P.A.,4 g/L,XD - Extra Dry,Light & Crisp,Pinot Grigio,,,
Villa Sandi Pinot Grigio delle Venezie DOC,https://www.lcbo.com/webapp/wcs/stores/servlet/en/lcbo/white-wine-14002/villa-sandi-pinot-grigio-delle-venezie-doc-580324,$12.80,/content/dam/lcbo/products/580324.jpg/jcr:content/renditions/cq5dam.web.319.319.jpeg,"Pale straw yellow colour; a subtle leesy/yeasty opening, followed by nutty and melon aromas with mineral overtones; extra dry, with the aromas replays on the palate to a cleansing finish.",750 mL bottle,11.5%,"Veneto, Italy",Villa Sandi Spa,4 g/L,XD - Extra Dry,Light & Crisp,Pinot Grigio,,,
XOXO Light Pinot Grigio,https://www.lcbo.com/webapp/wcs/stores/servlet/en/lcbo/white-wine-14002/xoxo-light-pinot-grigio-581124,$11.95,/content/dam/lcbo/products/581124.jpg/jcr:content/renditions/cq5dam.web.319.319.jpeg,"A great choice when hosting, this wine by XOXO is lower in alcohol than most pinot grigios, with delicate lifted aromas and flavours of canteloup, honey, nuts and banana. Medium-bodied with a fresh and clean finish, it is an ideal match for seafood paella, fettuccine Alfredo with grilled chicken or as an aperitif.",750 mL bottle,8%,"Ontario, Canada",Andrew Peller Limited,17 g/L,D - Dry,Light & Crisp,Pinot Grigio,,,
Peller Estates Family Series Dry Riesling VQA,https://www.lcbo.com/webapp/wcs/stores/servlet/en/lcbo/white-wine-14002/peller-estates-family-series-dry-riesling-vqa-582817,$12.95,/content/dam/lcbo/products/582817.jpg/jcr:content/renditions/cq5dam.web.319.319.jpeg,"Pale straw; quince, spice and nutty aromas; off-dry, with quince and light spice fruit.",750 mL bottle,11.5%,Canada,Andrew Peller Limited,19 g/L,M - Medium,Light & Crisp,Riesling,,,
Peller Estates Family Series Chardonnay VQA,https://www.lcbo.com/webapp/wcs/stores/servlet/en/lcbo/wine-14/white-wine-14002/peller-estates-family-series-chardonnay-vqa-582825,$10.95$11.95Save $1.00,/content/dam/lcbo/products/582825.jpg/jcr:content/renditions/cq5dam.web.319.319.jpeg,"Medium straw; floral, apple, lemon & oak aromas; dry, crisp with green apple & pear flavours.Medium straw colour; vanilla, smoky oak and yellow plum/pear aromas with a hint of hazelnuts; dry, medium bodied, soft acidity, with yellow plum/pear flavours.",750 mL bottle,12.5%,"Ontario, Canada",Andrew Peller Limited,7 g/L,XD - Extra Dry,Light & Crisp,Chardonnay,,,
RedHeads Le Betard White 2017,https://www.lcbo.com/webapp/wcs/stores/servlet/en/lcbo/white-wine-14002/redheads-le-betard-white-2017-587161,$30.05,/content/dam/lcbo/products/587161.jpg/jcr:content/renditions/cq5dam.web.319.319.jpeg,"Pale yellow straw with bright, ripe fruit aromas and typical Marsanne notes of dried herbs. Young and exuberant in honeyed peachy and candied lemon notes with bright acidity and satisfying rounded creaminess. Time in oak has lent a subtle oaky wrap of cinnamon spice to the pert peach and citrus fruit.",750 mL bottle,12.5%,Australia,Handcrafted Wines Pty Limited,,,,White Blend,,,
RedHeads Bluebelle Chardonnay 2017,https://www.lcbo.com/webapp/wcs/stores/servlet/en/lcbo/white-wine-14002/redheads-bluebelle-chardonnay-2017-587179,$27.15,/content/dam/lcbo/products/587179.jpg/jcr:content/renditions/cq5dam.web.319.319.jpeg,"Mid gold, classic Chardonnay colour, with high-note aromatics of honeysuckle blending with creamy toast. Fresh apple and peach overlaid by toasty nutty character with a taut backbone of freshness. A delicious balance and impressive length.",750 mL bottle,12.5%,Australia,Handcrafted Wines Pty Limited,,,,Chardonnay,,,
Placido Pinot Grigio Toscana IGT,https://www.lcbo.com/webapp/wcs/stores/servlet/en/lcbo/white-wine-14002/placido-pinot-grigio-toscana-igt-588897,$12.80,/content/dam/lcbo/products/588897.jpg/jcr:content/renditions/cq5dam.web.319.319.jpeg,"Pale straw colour; fresh bread, banana, pear, mango aromas with a nutty hint; clean fresh palate with banana and pear flavours and a long finish.",750 mL bottle,12.5%,"Veneto, Italy",Banfi Distribuzione Srl,7 g/L,D - Dry,Light & Crisp,Pinot Grigio,,,
Mezzacorona Pinot Grigio,https://www.lcbo.com/webapp/wcs/stores/servlet/en/lcbo/white-wine-14002/mezzacorona-pinot-grigio-589010,$22.95$25.95Save $3.00,/content/dam/lcbo/products/589010.jpg/jcr:content/renditions/cq5dam.web.319.319.jpeg,"Pale straw colour; fresh, berry, cantaloupe and fruity pear nose with a touch of spice; medium body, clean and fresh with berry and melon flavours and pear and spice on the finish.",1500 mL bottle,12.5%,"Trentino, Italy",Nosio Spa,4 g/L,XD - Extra Dry,Light & Crisp,Pinot Grigio,,,
Peller Family Vineyards Dry White,https://www.lcbo.com/webapp/wcs/stores/servlet/en/lcbo/white-wine-14002/peller-family-vineyards-dry-white-589051,$37.10$38.10Save $1.00,/content/dam/lcbo/products/589051.jpg/jcr:content/renditions/cq5dam.web.319.319.jpeg,"Pale yellow straw; grapefruit, yellow melon and floral aromas; extra dry with soft round fruit flavours and light tropical fruit notes; easy drinking wine.",4000 mL bagnbox,12%,Canada,Andrew Peller Limited,12 g/L,D - Dry,Light & Crisp,Blend,,,
Louis Bernard CdRhone White AOC,https://www.lcbo.com/webapp/wcs/stores/servlet/en/lcbo/white-wine-14002/louis-bernard-cdrhone-white-aoc-589432,$14.80,/content/dam/lcbo/products/589432.jpg/jcr:content/renditions/cq5dam.web.319.319.jpeg,"Pale straw colour; pear and nutmeg aromas and flavours with fresh mushrooms, honey and cantaloupe notes; extra dry, light to medium bodied, well balanced, soft supportive acidity, long lingering finish.",750 mL bottle,13%,"Rhône, France",Louis Bernard,2 g/L,XD - Extra Dry,Aromatic & Flavourful,Grenache Blanc,,,
Argento Seleccion Chardonnay,https://www.lcbo.com/webapp/wcs/stores/servlet/en/lcbo/white-wine-14002/argento-seleccion-chardonnay-591701,$10.00,/content/dam/lcbo/products/591701.jpg/jcr:content/renditions/cq5dam.web.319.319.jpeg,"Brilliant yellow/gold colour; floral, fresh figs and vanilla aromas and toast and nuts in the background; extra dry, with tropical fruit flavours with some toasty oak notes; excellent intensity and length.",750 mL bottle,13.5%,Argentina,Bodega Argento,2 g/L,XD - Extra Dry,Full-bodied & Rich,Chardonnay,,,
Pelee Island Late Harvest Vidal VQA,https://www.lcbo.com/webapp/wcs/stores/servlet/en/lcbo/white-wine-14002/pelee-island-late-harvest-vidal-vqa-594184,$13.95,/content/dam/lcbo/products/594184.jpg/jcr:content/renditions/cq5dam.web.319.319.jpeg,"Medium straw yellow colour; aromas of mango, nuts, yellow melon, pear and fresh fig; medium sweet, with soft balanced acidity and mango/melon flavours.",750 mL bottle,11.7%,"Ontario, Canada",Pelee Island Vineyard Inc.,33 g/L,M - Medium,Aromatic & Flavourful,Vidal,,,
Pelee Island Monarch Vidal VQA,https://www.lcbo.com/webapp/wcs/stores/servlet/en/lcbo/white-wine-14002/pelee-island-monarch-vidal-vqa-594275,$18.95,/content/dam/lcbo/products/594275.jpg/jcr:content/renditions/cq5dam.web.319.319.jpeg,"Located in Canada's warmest grape growing region. Pale straw yellow with lifted aromas and flavours of melon, orange, lychee and ripe pear. It has a refreshing palate with balanced acidity. Medium-bodied and fresh with a dry finish. This is a perfect choice for weekend brunch, cold cut sandwiches or grilled shrimp skewers.",1500 mL bottle,12.5%,"Ontario, Canada",Pelee Island Vineyard Inc.,12 g/L,D - Dry,Light & Crisp,Vidal,,,
Sonoma-Cutrer Russian River Ranches Chardonnay,https://www.lcbo.com/webapp/wcs/stores/servlet/en/lcbo/white-wine-14002/sonoma-cutrer-russian-river-ranches-chardonnay-608653,$27.95,/content/dam/lcbo/products/608653.jpg/jcr:content/renditions/cq5dam.web.319.319.jpeg,"An exquisite example of cool-climate Chardonnay, this favourite features tropical fruit, roasted hazelnut, citrus and butter. Serve with grilled salmon, Camembert with crusty bread, or stuffed pork tenderloin.",750 mL bottle,14.2%,"California, USA",Sonoma Cutrer Winery,4 g/L,XD - Extra Dry,Full-bodied & Rich,Chardonnay,"April 1, 2021",,
San Pietro Vino Bianco da Uve Passite,https://www.lcbo.com/webapp/wcs/stores/servlet/en/lcbo/white-wine-14002/san-pietro-vino-bianco-da-uve-passite-609213,$49.30,/content/dam/lcbo/products/609213.jpg/jcr:content/renditions/cq5dam.web.319.319.jpeg,"Produced in the Veneto region, this flavourful, full-bodied white reveals ample character. Supple and satisfying, it shines with notes of honey, raisin, jam and tropical fruit. Sip it solo or pair it with white meat dishes.",500 mL bottle,14%,"Piedmont, Italy",Tenuta San Pietro In Tassarolo Az.,,,,Albarossa,,,
Lindemans Bin 65 Chardonnay,https://www.lcbo.com/webapp/wcs/stores/servlet/en/lcbo/white-wine-14002/lindemans-bin-65-chardonnay-610758,$19.40,/content/dam/lcbo/products/610758.jpg/jcr:content/renditions/cq5dam.web.319.319.jpeg,"Lindeman's is one of Australia's leading wine brands, and the ever-popular Bin 65 remains one of their flagship wines. Enjoy upfront aromas and flavours of tropical fruit, pear and a nicely balanced note of nutty oak. Light to medium bodied, with a fresh, clean finish; a perfect partner for seafood, chicken or pasta.",1500 mL bottle,13%,Australia,Lindeman's Wines,8 g/L,D - Dry,Full-bodied & Rich,Chardonnay,,,
Wolf Blass Yellow Label Sauvignon Blanc,https://www.lcbo.com/webapp/wcs/stores/servlet/en/lcbo/white-wine-14002/wolf-blass-yellow-label-sauvignon-blanc-611475,$15.70,/content/dam/lcbo/products/611475.jpg/jcr:content/renditions/cq5dam.web.319.319.jpeg,"Medium straw colour; upfront aromas of gooseberry, hay, citrus and nuts; extra dry, medium bodied, well balanced, with gooseberry, fresh herbs and lime flavours.",750 mL bottle,13%,Australia,Mildara Blass Limited,2 g/L,XD - Extra Dry,Light & Crisp,Sauvignon Blanc,,,
Pelee Island Pinot Grigio,https://www.lcbo.com/webapp/wcs/stores/servlet/en/lcbo/white-wine-14002/pelee-island-pinot-grigio-614826,$18.95,/content/dam/lcbo/products/614826.jpg/jcr:content/renditions/cq5dam.web.319.319.jpeg,"A perfect addition when hosting, this offering has lively aromas and flavours of nuts, fresh fig, herbs and toast. Medium-bodied and fresh, it finishes with vibrant acidity and echoes the nuts and fig notes.",1500 mL bottle,12%,Canada,Pelee Island Vineyard Inc.,10 g/L,D - Dry,Light & Crisp,Pinot Grigio,,,
Henry of Pelham Speck Family Reserve Chardonnay 2019,https://www.lcbo.com/webapp/wcs/stores/servlet/en/lcbo/white-wine-14002/henry-of-pelham-speck-family-reserve-chardonnay-2019-616466,$29.95,/content/dam/lcbo/products/616466.jpg/jcr:content/renditions/cq5dam.web.319.319.jpeg,"This a solid, well constructed, complex chardonnay that could use a year or three of bottle age. The aromas are a bit reserved at the moment but very complex with yellow fruit, custard, nutmeg, peat and mineral flinty notes. It is quite full bodied, firm and well balanced, with impressive structure and intensity. This is very good value. Score - 92. (David Lawrason, winealign.com, Oct. 30, 2020)",750 mL bottle,14%,"Ontario, Canada",Henry Of Pelham Family Est. Winery,4 g/L,XD - Extra Dry,Full-bodied & Rich,Chardonnay,"May 1, 2021",,
Pelee Island Lola Gewürztraminer VQA,https://www.lcbo.com/webapp/wcs/stores/servlet/en/lcbo/white-wine-14002/pelee-island-lola-gew%C3%BCrztraminer-vqa-618231,$13.95,/content/dam/lcbo/products/618231.jpg/jcr:content/renditions/cq5dam.web.319.319.jpeg,"Lola first arrived as rosé and won our hearts; now you can try the fragrant gewurztraminer which is in full bloom with aromas of jasmine, lychee, pear, herbs and mango. Medium-bodied and dry, the flavours match the nose and wrap-up seamlessly on a long, flavourful finish.",750 mL bottle,12%,"Ontario, Canada",Pelee Island Vineyard Inc.,7 g/L,XD - Extra Dry,Off-dry & Fruity,Gewürztraminer,,,
Babich Sauvignon Blanc,https://www.lcbo.com/webapp/wcs/stores/servlet/en/lcbo/white-wine-14002/babich-sauvignon-blanc-620054,$17.70,/content/dam/lcbo/products/620054.jpg/jcr:content/renditions/cq5dam.web.319.319.jpeg,"Pale yellow; floral, passion fruit, citrus and herbal notes; balanced acidity with bright passion fruit and citrus flavours.",750 mL bottle,13%,"Marlborough, New Zealand",Babich Wines,6 g/L,XD - Extra Dry,Aromatic & Flavourful,Sauvignon Blanc,,,
Monkey Bay Sauvignon Blanc,https://www.lcbo.com/webapp/wcs/stores/servlet/en/lcbo/white-wine-14002/monkey-bay-sauvignon-blanc-620062,$13.85,/content/dam/lcbo/products/620062.jpg/jcr:content/renditions/cq5dam.web.319.319.jpeg,"Bright clean yellow straw colour; kiwi, floral and citrus aromas with hints of gooseberry and pear; extra dry, medium bodied, with the same kiwi, plus citrus and herbal flavours; good length.",750 mL bottle,13%,New Zealand,Nobilo Vintners,5 g/L,XD - Extra Dry,Aromatic & Flavourful,Sauvignon Blanc,,,
Angels Gate Sussreserve Riesling VQA,https://www.lcbo.com/webapp/wcs/stores/servlet/en/lcbo/white-wine-14002/angels-gate-sussreserve-riesling-vqa-620104,$13.95,/content/dam/lcbo/products/620104.jpg/jcr:content/renditions/cq5dam.web.319.319.jpeg,"Pale lemon colour; lifted aromas of smoke, mushrooms and citrus with a wild honey note; dry, medium bodied, bright, flavours of smoke and citrus with mushrooms and honey tones.",750 mL bottle,11.5%,"Ontario, Canada",Angels Gate Winery,19 g/L,M - Medium,Off-dry & Fruity,Riesling,,,
Argento Seleccion Pinot Grigio,https://www.lcbo.com/webapp/wcs/stores/servlet/en/lcbo/white-wine-14002/argento-seleccion-pinot-grigio-620492,$11.55,/content/dam/lcbo/products/620492.jpg/jcr:content/renditions/cq5dam.web.319.319.jpeg,Pale straw colour; peach and tropical fruit aromas; extra dry palate with medium body and crisp flavours.,750 mL bottle,13.5%,Argentina,Bodega Argento,2 g/L,XD - Extra Dry,Light & Crisp,Pinot Grigio,,,
Dragani Pinot Grigio Trebbiano IGT,https://www.lcbo.com/webapp/wcs/stores/servlet/en/lcbo/white-wine-14002/dragani-pinot-grigio-trebbiano-igt-620583,$21.10,/content/dam/lcbo/products/620583.jpg/jcr:content/renditions/cq5dam.web.319.319.jpeg,"Very pale straw with a a upfront aromas of mint, herbs, spice and ginger. Fresh in the mouth with fresh mint, herbs, some pear and granny apple zest. Clean and fruity minerality through the finish.",2000 mL bottle,12%,"Abruzzo, Italy",Cantine Dragani Srl,2 g/L,XD - Extra Dry,Light & Crisp,Blend,,,
Collavini Pinot Grigio,https://www.lcbo.com/webapp/wcs/stores/servlet/en/lcbo/white-wine-14002/collavini-pinot-grigio-620617,$26.05,/content/dam/lcbo/products/620617.jpg/jcr:content/renditions/cq5dam.web.319.319.jpeg,"This pinot grigio is a customer favourite, and it's easy to see why. It's pale straw, with inviting aromas of lemon, pear, and apple. The palate offers flavours of apricot, grapefruit and a hint of honey. It's light-bodied and crisp, with a palate-cleansing finish. Pair with mushroom risotto or grilled shrimp.",1500 mL bottle,12.5%,"Veneto, Italy",Eugenio Collavini Viticoltori S.R.L,4 g/L,XD - Extra Dry,Light & Crisp,Pinot Grigio,,,
Creekside Sauvignon Blanc VQA,https://www.lcbo.com/webapp/wcs/stores/servlet/en/lcbo/white-wine-14002/creekside-sauvignon-blanc-vqa-620724,$15.95,/content/dam/lcbo/products/620724.jpg/jcr:content/renditions/cq5dam.web.319.319.jpeg,Pale lemon colour; intense aromas of grapefruit and gooseberry with mineral and herbal streaks; tangy guava flavours with a zesty grapefruit finish.,750 mL bottle,12.7%,"Ontario, Canada",Creekside Estate Winery,4 g/L,XD - Extra Dry,Light & Crisp,Sauvignon Blanc,,,
Masi Masianco Pinot Grigio,https://www.lcbo.com/webapp/wcs/stores/servlet/en/lcbo/white-wine-14002/masi-masianco-pinot-grigio-620773,$16.85,/content/dam/lcbo/products/620773.jpg/jcr:content/renditions/cq5dam.web.319.319.jpeg,"Made using a blend of freshly-harvested pinot grigio and semi-dried verduzzo grapes. Enjoy floral aromas and flavours of citrus and nuts with mineral and honeyed notes. The wine is medium bodied with soft acidity and clean finish. Serve with hors d'oeuvres, fish or white meats.",750 mL bottle,13%,"Veneto, Italy",Masi Agricola S.P.A.,3 g/L,XD - Extra Dry,Light & Crisp,Blend,,,
Jackson-Triggs Pinot Grigio,https://www.lcbo.com/webapp/wcs/stores/servlet/en/lcbo/white-wine-14002/jackson-triggs-pinot-grigio-621110,$10.95,/content/dam/lcbo/products/621110.jpg/jcr:content/renditions/cq5dam.web.319.319.jpeg,"From an award-winning winery comes this light and lively pinot grigio, offered in a range of sizes for all occasions. Pouring a pale lemon colour, look for aromas and flavours of lifted, fresh cantaloupe, ginger and spice. Moderate acidity makes this fresh, it is extra-dry on that palate with a clean finish.",750 mL bottle,12.1%,"Ontario, Canada","Arterra Wines Canada, Inc.",5 g/L,XD - Extra Dry,Light & Crisp,Pinot Grigio,,,
Pelee Island Pinot Grigio,https://www.lcbo.com/webapp/wcs/stores/servlet/en/lcbo/white-wine-14002/pelee-island-pinot-grigio-621219,$10.95,/content/dam/lcbo/products/621219.jpg/jcr:content/renditions/cq5dam.web.319.319.jpeg,"A perfect addition when hosting, this offering has lively aromas and flavours of nuts, fresh fig, herbs and toast. Medium-bodied and fresh, it finishes with vibrant acidity and echoes the nuts and fig notes.",750 mL bottle,11.9%,Canada,Pelee Island Vineyard Inc.,10 g/L,D - Dry,Light & Crisp,Pinot Grigio,,,
"Relax Riesling, Mosel",https://www.lcbo.com/webapp/wcs/stores/servlet/en/lcbo/white-wine-14002/relax-riesling-mosel-621888,$12.75,/content/dam/lcbo/products/621888.jpg/jcr:content/renditions/cq5dam.web.319.319.jpeg,"Light green straw colour; aromas of tangerine, peach, white spice and black slate, with light floral tones; off-dry, medium-plus bodied, with balanced citrus acidity and tangerine and peach flavours.",750 mL bottle,9.5%,"Mosel, Germany",H. Schmitt Soehne,40 g/L,MS - Medium Sweet,Off-dry & Fruity,Riesling,,,
Peller Family Vineyards Sauvignon Blanc,https://www.lcbo.com/webapp/wcs/stores/servlet/en/lcbo/white-wine-14002/peller-family-vineyards-sauvignon-blanc-623322,$40.95$43.95Save $3.00,/content/dam/lcbo/products/623322.jpg/jcr:content/renditions/cq5dam.web.319.319.jpeg,"A crisp, easy drinking white in an easy to serve box. In the glass, it's a pale, lemon green colour. On the nose the wine exhibits, forward aromas of grapefruit, herb, lemon and melon with light tropical, pear and grassy notes. The palate is dry, light-bodied and crisp with light peach, apple, melon and citrus flavours.",4000 mL bagnbox,12%,Canada,Andrew Peller Limited,10 g/L,D - Dry,Light & Crisp,Sauvignon Blanc,,,
Road Vineyard Chardonnay 2016,https://www.lcbo.com/webapp/wcs/stores/servlet/en/lcbo/white-wine-14002/road-vineyard-chardonnay-2016-627470,$38.95,/content/dam/lcbo/products/627470.jpg/jcr:content/renditions/cq5dam.web.319.319.jpeg,"This crowd-pleasing dry Chardonnay has juicy notes of baked pear, nectarine, vanilla and biscuit, all rolled up in a spicy, fragrant nose. The long crème brûlée finish comes as a welcome surprise. Try it with a cheese tray.",750 mL bottle,13%,"Central Otago, New Zealand",Domain Road Vineyard,,,,Chardonnay,,,
