Domaine Ponsot Cuvée de la Mesange Saint-Romain 2017,https://www.lcbo.com/webapp/wcs/stores/servlet/en/lcbo/white-wine-14002/domaine-ponsot-cuv%C3%A9e-de-la-mesange-saint-romain-2017-688697,$103.00,/content/dam/lcbo/products/688697.jpg/jcr:content/renditions/cq5dam.web.319.319.jpeg,,750 mL bottle,13.5%,"Burgundy, France",Domaine Ponsot Sarl,2 g/L,XD - Extra Dry,Full-bodied & Rich,Chardonnay,,,
Bott Geyl Riesling GC Schoenenbourg 2014,https://www.lcbo.com/webapp/wcs/stores/servlet/en/lcbo/white-wine-14002/bott-geyl-riesling-gc-schoenenbourg-2014-548817,$85.35,/content/dam/lcbo/products/548817.jpg/jcr:content/renditions/cq5dam.web.319.319.jpeg,"Crisp green apples on the nose, with grapefruit rind savouriness. Honey, marmalade and spice on the palate with an intense finish. An organic and biodynamic producer.",750 mL bottle,13%,"Alsace, France",That's Life Gourmet Ltd,,,,Riesling,,,
Aveleda Loureiro 2017,https://www.lcbo.com/webapp/wcs/stores/servlet/en/lcbo/white-wine-14002/aveleda-loureiro-2017-646067,$13.95,/content/dam/lcbo/products/646067.jpg/jcr:content/renditions/cq5dam.web.319.319.jpeg,"The 2017 Loureiro Colheita Selecionada comes in with eight grams of sugar and 11.5% alcohol and no fizz. Sourced from a mixture of subregions, this is another stunning value from Aveleda this issue. No one cries for Goliath, but it is easy to forget how good the Aveleda wines can be for such modest money. The sugar is completely balanced by the acidity here. There's a hint of off-dry but no more than that. It shows good concentration, especially for this level, a fine, tense finish, and a tinge of lime on that finish. I personally preferred this to the regular Estate Branco this issue, but they are close and reasonable minds might differ. Typically, what Aveleda makes also ages very well. They won't necessarily blossom and improve dramatically, but I won't be surprised if this is still fine and still at peak five years from now. It will be great this summer too. Drink Date: 2018-2024.  Score - 90. (Mark Squires, robertparker.com, June 29, 2018)",750 mL bottle,11.4%,"Douro, Portugal",Sociedade Agricola E. Comercial,7 g/L,D - Dry,Light & Crisp,Vinho Verde,"July 20, 2019",,
Domaine Jean-Louis Chave Hermitage Blanc 2017,https://www.lcbo.com/webapp/wcs/stores/servlet/en/lcbo/white-wine-14002/domaine-jean-louis-chave-hermitage-blanc-2017-387274,$318.00,/content/dam/lcbo/products/387274.jpg/jcr:content/renditions/cq5dam.web.319.319.jpeg,"In the end, I'm unable to definitely say that the 2017 Hermitage Blanc is better than the stupendous 2016. Of course, I sampled it just three days after it was bottled, so I've appended the + to my rating, as there's a possibility the wine may have been affected by that process. It's gently toasty but dominated at this stage by forward melon and pineapple fruit. Full-bodied and incredibly rich yet balanced, it unfolds in waves of flavor and texture, lingering for what seems like minutes on the finish. Hit it soon to enjoy its youthful opulence, or put it aside for 10-12 years. Drink date: 2020-2040. Score - 98+. (Joe Czerwinski, robertparker.com, Dec. 19, 2019)",750 mL bottle,13.5%,"Rhône, France",Jean-Louis Chave,4 g/L,XD - Extra Dry,Full-bodied & Rich,Marsanne Blend,"March 18, 2021",,
Tenuta Roveglia Vigne di Catullo Lugana Riserva 2014,https://www.lcbo.com/webapp/wcs/stores/servlet/en/lcbo/white-wine-14002/tenuta-roveglia-vigne-di-catullo-lugana-riserva-2014-437004,$26.95,/content/dam/lcbo/products/437004.jpg/jcr:content/renditions/cq5dam.web.319.319.jpeg,"100% Trebbiano di Lugana. Complex and multi-layered on the nose with honey, caramel, ginger, peaches and white flowers. Rich and round, sustained by crisp freshness with dry herbs and fennel seed notes. A great wine!  Score - 96. (Decanter World Wine Awards, 2018)",750 mL bottle,12%,"Lombardy, Italy",Tenuta Roveglia Zweifel-Azzone Snc,8 g/L,D - Dry,Full-bodied & Rich,Trebbiano,"August 3, 2019",,
Esk Valley Chardonnay 2017,https://www.lcbo.com/webapp/wcs/stores/servlet/en/lcbo/white-wine-14002/esk-valley-chardonnay-2017-149997,$24.95,/content/dam/lcbo/products/149997.jpg/jcr:content/renditions/cq5dam.web.319.319.jpeg,"A neat chardonnay with compact texture and some richer flavors. Aromas of peaches and almond nougat lead to a palate that tastes of buttered popcorn, then turns warm and takes on a hazelnut flavor through the finish. Drink now. Score - 90. (James Suckling, jamessuckling.com, Oct. 8, 2018)",750 mL bottle,13%,"Hawke's Bay, New Zealand",Villa Maria Estates Ltd.,4 g/L,XD - Extra Dry,Full-bodied & Rich,Chardonnay,"July 18, 2019",,
Pierpaolo Pecorari Pinot Grigio Friuli 2018,https://www.lcbo.com/webapp/wcs/stores/servlet/en/lcbo/white-wine-14002/pierpaolo-pecorari-pinot-grigio-friuli-2018-895291,$27.60,/content/dam/lcbo/products/895291.jpg/jcr:content/renditions/cq5dam.web.319.319.jpeg,"Aromas of golden apple, pineapple, alps hay, cherry blossom. Elegant & fresh on the palate, full body, with bright acidity. Fruity & stony minerality. Serve with fish dishes, crustaceans and seafood, pasta dishes, white meat.",750 mL bottle,12.5%,"Friuli, Italy",Uab Vsf International Consulting +,,,,Pinot Grigio,,,
Albert Bichot Domaine Long-Depaquit Les Clos Chablis Grand Cru 2018,https://www.lcbo.com/webapp/wcs/stores/servlet/en/lcbo/white-wine-14002/albert-bichot-domaine-long-depaquit-les-clos-chablis-grand-cru-2018-10184,$110.00,/content/dam/lcbo/products/010184.jpg/jcr:content/renditions/cq5dam.web.319.319.jpeg,"Beautiful subtlety on this wine's nose recalls smoky lemon, citrus pith and molten candlewax. The palate also holds these notions, bolstering that lemony waxiness with thick, layered chalkiness and pithy, mouthwatering freshness. This is concentated and bold, offering energy and drive, with a contradictory heat emanating from a cool core. A compelling wine, it needs to calm down a little. Drink date: 2025-2040. Score - 97. (Anne Krebiehl, MW, Wine Enthusiast, Dec. 31, 2020)",750 mL bottle,13%,"Burgundy, France",Maison Albert Bichot,2 g/L,XD - Extra Dry,Light & Crisp,Chardonnay,"May 6, 2021",,
Domaine Bouchard Père & Fils Genevrières Meursault 1er Cru 2016,https://www.lcbo.com/webapp/wcs/stores/servlet/en/lcbo/white-wine-14002/domaine-bouchard-p%C3%A8re-fils-genevri%C3%A8res-meursault-1er-cru-2016-87049,$129.00,/content/dam/lcbo/products/087049.jpg/jcr:content/renditions/cq5dam.web.319.319.jpeg,"Residual SO2 is sufficient to dominate the nose today. Marvelously energetic and intensely mineral-driven flavors also possess excellent cut that characterizes the bitter lemon and saline-inflected finish that delivers seriously fine length. This chiseled effort is almost Chablis-like and will require at least a few years of bottle age first. Sweet spot, Outstanding. Drink 2024+. Score - 93. (Allen Meadows, burghound.com, June 15, 2015)",750 mL bottle,13.5%,"Burgundy, France",Bouchard Pere & Fils,3 g/L,XD - Extra Dry,Full-bodied & Rich,Chardonnay,"September 5, 2019",,
Heymann-Löwenstein Röttgen GG Riesling,https://www.lcbo.com/webapp/wcs/stores/servlet/en/lcbo/white-wine-14002/heymann-l%C3%B6wenstein-r%C3%B6ttgen-gg-riesling-666370,$60.00,/content/dam/lcbo/products/666370.jpg/jcr:content/renditions/cq5dam.web.319.319.jpeg,,750 mL bottle,12%,"Mosel, Germany",Weingut Heymann-Lowenstien,8 g/L,,Aromatic & Flavourful,Riesling,,,
Peter Zemmer Giatl Riserva Pinot Grigio 2016,https://www.lcbo.com/webapp/wcs/stores/servlet/en/lcbo/white-wine-14002/peter-zemmer-giatl-riserva-pinot-grigio-2016-11605,$43.00,/content/dam/lcbo/products/011605.jpg/jcr:content/renditions/cq5dam.web.319.319.jpeg,"The oak-aged 2016 Alto Adige Pinot Grigio Riserva Giatl is a medium to full-bodied white wine with nuances of summer peach, Golden Delicious apple and lemon mousse. That chorus of yellow fruit flavors is really very beautiful. The wine wraps thickly over the palate with a rich texture and creamy disposition followed by breezy acidity. Some 11,000 bottles were produced. Drink Date: 2018-2024. Score - 92+. (Monica Larner, robertparker.com, Aug. 31, 2018)",750 mL bottle,14.5%,"Alto Adige, Italy",Peter Zemmer,2 g/L,XD - Extra Dry,Aromatic & Flavourful,Pinot Grigio,"October 3, 2019",,
De Wetshof Bataleur Chardonnay 2016,https://www.lcbo.com/webapp/wcs/stores/servlet/en/lcbo/white-wine-14002/de-wetshof-bataleur-chardonnay-2016-10012,$59.95,/content/dam/lcbo/products/010012.jpg/jcr:content/renditions/cq5dam.web.319.319.jpeg,"Gravel soils rich in limestone and clay produce a Chardonnay of supreme elegance and florality. Pear drop and citrus elements on the nose lead to controlled richness on the palate whose classy, harmonious finish assures a great future. Drinking Window: 2019-2026. Score - 95. (Steven Spurrier, decanter.com, Undated)",750 mL bottle,14%,"Robertson, South Africa",De Wetshof Estate,2 g/L,XD - Extra Dry,,Chardonnay,"July 18, 2019",,
Doudet Naudin Vin de France Chardonnay 2017,https://www.lcbo.com/webapp/wcs/stores/servlet/en/lcbo/white-wine-14002/-doudet-naudin-vin-de-france-chardonnay-2017-250687,$16.20,/content/dam/lcbo/products/250687.jpg/jcr:content/renditions/cq5dam.web.319.319.jpeg,"Aromatic, fine, and well-balanced wine with its light golden colour with some green highlights. Nuances and taste of linden-tree, mango, peach and some citrus. In the mouth the wine is very charming, thanks to its freshness and its fruity aromas.",750 mL bottle,12.5%,"Burgundy, France",Doudet Naudin + Cie Sasdev,,,,Chardonnay,,,
Anthosmias White,https://www.lcbo.com/webapp/wcs/stores/servlet/en/lcbo/white-wine-14002/anthosmias-white-336957,$18.30,/content/dam/lcbo/products/336957.jpg/jcr:content/renditions/cq5dam.web.319.319.jpeg,"An excellent medium sweet rose wine. Light rose in colour, with crisp and refreshing intense flower, fruit, and honey flavours. A good firm structure with a long luxurious finish.",750 mL bottle,13%,Greece,G. Tsimpidis And Co. Monemvasia Win,,,,Moschofilero,,,
Estate Argyros Vinsanto 4 Year 2011,https://www.lcbo.com/webapp/wcs/stores/servlet/en/lcbo/white-wine-14002/estate-argyros-vinsanto-4-year-2011-300219,$70.90,/content/dam/lcbo/products/300219.jpg/jcr:content/renditions/cq5dam.web.319.319.jpeg,"The wine has a copper-amber colour and on the nose strong and complex aromas of chocolate, honey, roasted coffee grains, dried fruits and dried nuts. On the palate the wine is full bodied, buttery, well structured & balanced, with sweetness and acidity in harmony, it has a fine and long finish.",500 mL bottle,13.5%,"Santorini, Greece",Estate I. & M. Argyros O.E.,,,,White - Sweet,,,
Charles Heintz Chardonnay 2017,https://www.lcbo.com/webapp/wcs/stores/servlet/en/lcbo/white-wine-14002/charles-heintz-chardonnay-2017-535541,$126.05,/content/dam/lcbo/products/535541.jpg/jcr:content/renditions/cq5dam.web.319.319.jpeg,White flowers reach out of the glass like jasmine and the palate is a smooth yet rich expression of tropical and mineral flavours. The weight and texture of this wine is gracefully balanced by the acidity and what feels like a never-ending finish.,750 mL bottle,14.5%,"California, USA",Senses Wines,,,,Chardonnay,,,
Kir Yianni Assyrtiko 2018,https://www.lcbo.com/webapp/wcs/stores/servlet/en/lcbo/white-wine-14002/kir-yianni-assyrtiko-2018-294099,$21.40,/content/dam/lcbo/products/294099.jpg/jcr:content/renditions/cq5dam.web.319.319.jpeg,"Made with 100% Assyrtiko, this wine is intense, with refreshing acidity and firm structure. Serve with fish fillet (roasted or poached), fried cod, oven-roasted stuffed squid, pasta in white sauce, white cheeses.",750 mL bottle,13.5%,"Macedonia, Greece",Kir-Yianni S.A.,,,,Assyrtiko,,,
Domaine Guenault Touraine Sauvignon Blanc AOC 2018,https://www.lcbo.com/webapp/wcs/stores/servlet/en/lcbo/white-wine-14002/domaine-guenault-touraine-sauvignon-blanc-aoc-2018-871459,$14.80,/content/dam/lcbo/products/871459.jpg/jcr:content/renditions/cq5dam.web.319.319.jpeg,"This Loire white displays the classic properties of the grape and has a golden colour with a green sheen. It has an aromatic nose with fruity characters, zesty citrus fruits, cut grass, crisp and fresh white buds aromas. In the mouth, flavours of gooseberry and herbs persist.",750 mL bottle,13.5%,France,Bougrier S.A.,,,,Sauvignon Blanc,,,
Chateau Miqueu Haut Medoc AOC 2015,https://www.lcbo.com/webapp/wcs/stores/servlet/en/lcbo/white-wine-14002/chateau-miqueu-haut-medoc-aoc-2015-857029,$19.95,/content/dam/lcbo/products/857029.jpg/jcr:content/renditions/cq5dam.web.319.319.jpeg,"Fairly deep and intense colour with nice bright hints. The nose reveals delightful black fruits aromas, slightly toasted. The attack is elegant and characterized by lightly grilled notes. Fleshy and ripe tannins mid-palate. Long and silky finish with blackberry and blackcurrant notes.",750 mL bottle,12.5%,France,Sv Grandschateaux,,,,Petit Verdot/Cabernet Sauvignon/Merlot,,,
The Lady Pinot Grigio Delle Venezie 2018,https://www.lcbo.com/webapp/wcs/stores/servlet/en/lcbo/white-wine-14002/the-lady-pinot-grigio-delle-venezie-2018-321637,$14.95,/content/dam/lcbo/products/321637.jpg/jcr:content/renditions/cq5dam.web.319.319.jpeg,"Cosmopolitan globe-trotter, an international vision on the world. I do not follow trends, I anticipate them. I have an unique style and an unmistakable identity, I distinguish myself for unconventional details.",750 mL bottle,12%,"Veneto, Italy",3rockets Srl - Ferro13,,,,Pinot Grigio,,,
Nederburg Manor House Sauvignon Blanc 2018,https://www.lcbo.com/webapp/wcs/stores/servlet/en/lcbo/white-wine-14002/nederburg-manor-house-sauvignon-blanc-2018-372334,$14.75,/content/dam/lcbo/products/372334.jpg/jcr:content/renditions/cq5dam.web.319.319.jpeg,"Avoiding greenness is very much the aim of this unwooded, passion fruity Sauvignon Blanc from Darling. Zesty and fresh with a hint of sea breeze, it's a pleasure to drink. Drink Date: 2019-2021. Score - 90. (Tim Atkin, MW, timatkin.com, South Africa Special Report 2018)",750 mL bottle,13.5%,"Western Cape, South Africa",Distell,2 g/L,XD - Extra Dry,Aromatic & Flavourful,Sauvignon Blanc,"September 14, 2019",,
Domaine Louis Jadot Charmes Meursault 1er Cru 2018,https://www.lcbo.com/webapp/wcs/stores/servlet/en/lcbo/white-wine-14002/domaine-louis-jadot-charmes-meursault-1er-cru-2018-404855,$132.00,/content/dam/lcbo/products/404855.jpg/jcr:content/renditions/cq5dam.web.319.319.jpeg,"Very opulent white with pure apple, mango and lemon-pie character. Some toffee undertones. Full-bodied with depth and intensity on the palate, creamy texture and a frame of acidity. Lots of flavor with a nice, wood and vanilla complement to the fruit at the end. Drink or hold. Score - 95. (jamessuckling.com, Aug. 24, 2020)",750 mL bottle,13.5%,"Burgundy, France",Maison Louis Jadot,2 g/L,XD - Extra Dry,Full-bodied & Rich,Chardonnay,"November 12, 2020",,
Domaine Louis Jadot Monopole Clos de la Chapelle Chassagne-Montrachet Morgeot 1er Cru 2018,https://www.lcbo.com/webapp/wcs/stores/servlet/en/lcbo/white-wine-14002/domaine-louis-jadot-monopole-clos-de-la-chapelle-chassagne-montrachet-morgeot-1er-cru-2018-436741,$125.00,/content/dam/lcbo/products/436741.jpg/jcr:content/renditions/cq5dam.web.319.319.jpeg,"The 2018 Chassagne-Montrachet 1er Cru Morgeot Clos de la Chapelle (Domaine du Duc de Magenta) is showing well, opening in the glass with notes of crisp green orchard fruit, dried white flowers, fresh pastry and blanched almonds. On the palate, it's medium to full-bodied, structured and tangy, with lively acids and good dry extract. Score - 92-94 . (William Kelley, robertparker.com, Jan. 9, 2020)",750 mL bottle,13.5%,"Burgundy, France",Maison Louis Jadot,2 g/L,XD - Extra Dry,Full-bodied & Rich,Chardonnay,"November 12, 2020",,
Domaine Louis Jadot Les Folatières Puligny-Montrachet 1er Cru 2018,https://www.lcbo.com/webapp/wcs/stores/servlet/en/lcbo/white-wine-14002/domaine-louis-jadot-les-folati%C3%A8res-puligny-montrachet-1er-cru-2018-404863,$140.00,/content/dam/lcbo/products/404863.jpg/jcr:content/renditions/cq5dam.web.319.319.jpeg,"Pungent aromas of strong petrol and wood toast largely bury the otherwise softly exotic aromas of passion fruit and white peach. There is a lovely sense of vibrancy to the highly seductive if not especially dense middle weight flavors that exude a subtle minerality on the lingering finish that tightens up rapidly as it sits on the palate. This is still coming together but it appears as though it will blossom in time. Drink: 2028+. Sweet spot. Outstanding. Score - 91-93. (Allen Meadows, burghound.com, June 10, 2020)",750 mL bottle,13.5%,"Burgundy, France",Maison Louis Jadot,2 g/L,XD - Extra Dry,Full-bodied & Rich,Chardonnay,"November 12, 2020",,
Falchini Vigna a Solatio Vernaccia di San Gimignano 2017,https://www.lcbo.com/webapp/wcs/stores/servlet/en/lcbo/white-wine-14002/falchini-vigna-a-solatio-vernaccia-di-san-gimignano-2017-994012,$20.95,/content/dam/lcbo/products/994012.jpg/jcr:content/renditions/cq5dam.web.319.319.jpeg,"Tuscany's most famous white wine style is made from the Vernaccia grape grown around the ancient village of San Gimignano. This stunning example shows aromas of green apple and citrus, with a sleek, mineral-laced palate and a touch of bitter nuttiness on the finish. Ideal for grilled seafood or pulled pork. (Vintages panel, July 2018)",750 mL bottle,12%,"Tuscany, Italy",Casale Falchini,2 g/L,XD - Extra Dry,Light & Crisp,Vernaccia,"September 14, 2019",,
Dagueneau Pouilly Fume Clos Chaudoux 2017,https://www.lcbo.com/webapp/wcs/stores/servlet/en/lcbo/white-wine-14002/dagueneau-pouilly-fume-clos-chaudoux-2017-878959,$47.65,/content/dam/lcbo/products/878959.jpg/jcr:content/renditions/cq5dam.web.319.319.jpeg,"Noble, fresh and deeply aromatic on the clear nose, with flinty aromas of star fruit, yeast, herbs and bacon. This is a firmly structured, dense, rich, full-bodied and powerful late harvest sauvignon blanc. Lots of complexity to this one.",750 mL bottle,13.5%,"Loire, France",Scea Domaine Serge Dagueneau E,,,,Sauvignon Blanc,,,
Domaine du Crêt de Bine Cuvée de Florence 2018,https://www.lcbo.com/webapp/wcs/stores/servlet/en/lcbo/white-wine-14002/domaine-du-cr%C3%AAt-de-bine-cuv%C3%A9e-de-florence-2018-365436,$29.80,/content/dam/lcbo/products/365436.jpg/jcr:content/renditions/cq5dam.web.319.319.jpeg,"This is 100% chardonnay grown in the Southern region of Beaujolais. It's bright and crisp with notes of apple and stone fruit. Two thirds were aged in used oak, so expect a touch of spice. Excellent balance leads to a great finish. Certified Organic & Biodynamic.",750 mL bottle,12.5%,"Burgundy, France",Scea Subrin Et Associes - Domaine D,,,,Chardonnay,,,
Vino Lauria Solerte Bianco 2018,https://www.lcbo.com/webapp/wcs/stores/servlet/en/lcbo/wine-14/white-wine-14002/vino-lauria-solerte-bianco-2018-457266,$26.55,/content/dam/lcbo/products/457266.jpg/jcr:content/renditions/cq5dam.web.319.319.jpeg,"This is made with 100% Moscato grapes, known as Zibibbo in Sicily. It's a dry wine, offering up lots of pink grapefruit, honeysuckle, and floral notes, backed by mouthwatering cripness and minerality. Certified Organic.",750 mL bottle,11%,"Sicily, Italy",Lauria Vito,,,,Moscato,,,
Leeuwin Art Series Chardonnay 2017,https://www.lcbo.com/webapp/wcs/stores/servlet/en/lcbo/white-wine-14002/leeuwin-art-series-chardonnay-2017-619437,$99.00,/content/dam/lcbo/products/619437.jpg/jcr:content/renditions/cq5dam.web.319.319.jpeg,"This achieves another step up the quality ladder for Leeuwin Estate, seemingly impossible. There's been no change in the vinification, nor in the vineyard. The change is an increase in the intensity of the flavours, and hence their length and aftertaste. It's an extraordinary wine, among the greatest of Burgundy (and elsewhere in the world). Whatever you expect from its future development will be delivered. Drink by: 2032. Special Value. Rated as Best Chardonnay of the Year in the 2021 Halliday Wine Companion.  Score - 99. (James Halliday, winecompanion.com.au, Aug. 1, 2020)",750 mL bottle,13%,"Western Australia, Australia",Leeuwin Estate,3 g/L,XD - Extra Dry,Full-bodied & Rich,Chardonnay,"March 4, 2021",,
Zanatta Vermentino di Sardegna 2018,https://www.lcbo.com/webapp/wcs/stores/servlet/en/lcbo/white-wine-14002/zanatta-vermentino-di-sardegna-2018-172840,$18.35,/content/dam/lcbo/products/172840.jpg/jcr:content/renditions/cq5dam.web.319.319.jpeg,"This Cannonau Riserva stands out for its elegance. On the palate it is not too bold, nonetheless intense, structured, long lasting, and balanced. It has a garnet-red colour, a bouquet of ripe fruits together with notes of toasted oak and vanilla. A mix of spices and vanilla linger on the long finish.",750 mL bottle,12.5%,"Sardinia, Italy",D.I.V.I Srl,,,,Vermentino,,,
Domaine de Montille Corton-Charlemagne Grand Cru 2017,https://www.lcbo.com/webapp/wcs/stores/servlet/en/lcbo/white-wine-14002/domaine-de-montille-corton-charlemagne-grand-cru-2017-452490,$271.00,/content/dam/lcbo/products/452490.jpg/jcr:content/renditions/cq5dam.web.319.319.jpeg,"The purity of yellow citrus fruit here is stunning and there's a distinctive, chalky wedge to the nose, too. The palate has a very elegant, sleek and contained feel with a strong line of acidity and creamy, lees-derived weight. This has the DNA of power and the length is exceptional. Regal. Try in 2022. Score - 95-96. (jamessuckling.com, Feb. 12, 2019)",750 mL bottle,13%,"Burgundy, France",Sarl Domaine De Montille,2 g/L,XD - Extra Dry,Full-bodied & Rich,Pinot Noir,"April 22, 2021",,
Domaine William Fèvre Bougros Chablis Grand Cru 2017,https://www.lcbo.com/webapp/wcs/stores/servlet/en/lcbo/white-wine-14002/domaine-william-f%C3%A8vre-bougros-chablis-grand-cru-2017-941229,$109.00,/content/dam/lcbo/products/941229.jpg/jcr:content/renditions/cq5dam.web.319.319.jpeg,"A cool and ripe nose features notes of pear and apple that possess background nuances of iodine and seashell. There is excellent mid-palate concentration to the big, very rich and concentrated flavors that display a very round and suave mouth feel, all wrapped in a powerful, dry and slightly rustic finale. This muscular and robust effort delivers sneaky good length and while it needs to develop more depth, it has the potential aging curve to do so. Drink 2029+. Score - 93. (Allen Meadows, burghound.com, Oct. 10, 2019)",750 mL bottle,13%,"Burgundy, France",William Fevre,2 g/L,XD - Extra Dry,Light & Crisp,Chardonnay,"July 2, 2020",,
Bouchard Père & Fils Chevalier-Montrachet Grand Cru,https://www.lcbo.com/webapp/wcs/stores/servlet/en/lcbo/white-wine-14002/bouchard-p%C3%A8re-fils-chevalier-montrachet-grand-cru-88708,$524.00,/content/dam/lcbo/products/088708.jpg/jcr:content/renditions/cq5dam.web.319.319.jpeg,,750 mL bottle,13.5%,France,Bouchard Pere & Fils,,,Full-bodied & Rich,Chardonnay,,,
Joseph Drouhin Les Folatières Puligny-Montrachet 1er Cru,https://www.lcbo.com/webapp/wcs/stores/servlet/en/lcbo/white-wine-14002/joseph-drouhin-les-folati%C3%A8res-puligny-montrachet-1er-cru-968099,$159.00,/content/dam/lcbo/products/968099.jpg/jcr:content/renditions/cq5dam.web.319.319.jpeg,,750 mL bottle,13%,France,Joseph Drouhin S.A.,,,Full-bodied & Rich,Chardonnay,,,
Esk Valley Verdelho 2018,https://www.lcbo.com/webapp/wcs/stores/servlet/en/lcbo/white-wine-14002/esk-valley-verdelho-2018-483742,$25.00,/content/dam/lcbo/products/483742.jpg/jcr:content/renditions/cq5dam.web.319.319.jpeg,This Verdelho is sourced from our Omahu Gravels Vineyard located in the Gimblett Gravels and our organic Joseph Soler Vineyard on the outskirts of Flaxmere. The Omahu vines were planted in 1998 and hold the distinction of being the first Verdelho vines planted in New Zealand's recent viticultural history. The fruit reflects the stony soils in which they are grown and provides the wine with a mineral infused note and flavours of mandarin and passionfruit. These vines are intensively managed and cropped at low yields to fully capture the potential of the sites.,750 mL bottle,14%,New Zealand,Villa Maria Estate Limited,,,,Verdelho,,,
D.G. White 2018,https://www.lcbo.com/webapp/wcs/stores/servlet/en/lcbo/white-wine-14002/dg-white-2018-382548,$16.00,/content/dam/lcbo/products/382548.jpg/jcr:content/renditions/cq5dam.web.319.319.jpeg,"Yellow citrus colour and brilliant aspect. Intense aroma with notes of tropical fruits. In the mouth it is balanced, very fresh and has good structure.",750 mL bottle,13%,"Douro, Portugal",Vinilourenco Unipessoal Lda,,,,White Blend,,,
EA White 2018,https://www.lcbo.com/webapp/wcs/stores/servlet/en/lcbo/white-wine-14002/ea-white-2018-474345,$14.00,/content/dam/lcbo/products/474345.jpg/jcr:content/renditions/cq5dam.web.319.319.jpeg,"Citurs colour with a greenish hue. Intense aroma reminiscent of tropical fruit, fresh grass, with light floral notes. Well balanced in the palate showing good acidity.",750 mL bottle,12.5%,"Alentejo, Portugal",Fea Pt 500730733,,,,Antão Vaz Blend,,,
Schiopetto Pinot Grigio des Rosis 2018,https://www.lcbo.com/webapp/wcs/stores/servlet/en/lcbo/white-wine-14002/schiopetto-pinot-grigio-des-rosis-2018-545052,$31.45,/content/dam/lcbo/products/545052.jpg/jcr:content/renditions/cq5dam.web.319.319.jpeg,"This is a very minerally pinot grigio with undertones of sliced apples, pears and slate. Full-bodied, layered and beautiful.",750 mL bottle,13%,"Friuli, Italy",Terre Friulane S.R.L.,,,,Pinot Grigio,,,
Schiopetto Ribolla Gialla des Rosis 2018,https://www.lcbo.com/webapp/wcs/stores/servlet/en/lcbo/white-wine-14002/schiopetto-ribolla-gialla-des-rosis-2018-545060,$33.35,/content/dam/lcbo/products/545060.jpg/jcr:content/renditions/cq5dam.web.319.319.jpeg,"This is fantastic. There's a linear edge underlying the exotic mangoes and white peaches. Full-bodied, yet always energetic and tangy.",750 mL bottle,12%,"Friuli, Italy",Terre Friulane S.R.L.,,,,Ribolla Gialla,,,
